PROJECT_NUMBER,ABSTRACT_TEXT1
5 R01 AI087139-04,"   DESCRIPTION (provided by applicant): In many settings in Africa, women with unknown HIV status present late in pregnancy or in labor, and the postpartum period represents a major entry point for counseling, testing, and assessment for antiretroviral (ARV) treatment. ARV use in pregnant and breastfeeding women has clear benefits for mothers and infants. Furthermore, if an infant is already HIV-infected, breastfeeding is seen as posing no risk to the infant, and women are strongly encouraged to continue breastfeeding to maximize survival of the infant. However, use of highly active antiretroviral therapy (HAART) in breastfeeding women may induce ARV resistance in some HIV-infected infants, either through transfer of ARV-resistant strains from the mother to the infant, or by exposing the infant to biologically significant but sub-therapeutic amounts of ARV drugs, leading to selection of ARV-resistant HIV in infants who are already infected with ARV-susceptible HIV. Development of ARV resistance to more than one class of ARV drugs (multi-class resistance) in HIV-infected infants is likely to significantly reduce their chance of responding to life-saving ARV therapy. The hypothesis of this study is that maternal HAART induces multi-class ARV resistance in the majority of HIV-infected breastfeeding infants. This hypothesis will be tested using samples and data from the Post-Exposure Prophylaxis of Infants (PEPI) trial that was conducted in Blantyre, Malawi. In PEPI, approximately 90 women who initiated HAART postpartum had infants who were HIV-infected. Women and infants in PEPI received ARV drugs for prevention of mother-to-child transmission of HIV (pMTCT). Most women (~70%) received single dose nevirapine (sdNVP). All infants received sdNVP and 1 week of zidovudine (control regimen). Infants were then randomized at birth to receive either the control regimen alone, or the control regimen plus up to 14 weeks of extended daily NVP or extended daily NVP plus extended daily ZDV. These regimens were stopped immediately in infants with confirmed HIV infection. Because these pMTCT regimens are known to cause selection of NVP-resistant HIV in some women and some HIV-infected infants, exposure to pMTCT regimens will be considered in our analysis. The Specific Aims of this proposal are: Aim 1: Test whether initiation of maternal HAART postpartum is associated with emergence of multi-class resistance in HIV- infected breastfeeding infants. Aim 2: Analyze HIV viral load, ARV drug levels, and HIV drug resistance in breast milk samples from women on HAART. These studies will quantify the prevalence of multi-class resistance in infant plasma and breast milk after maternal HAART initiation, and will identify factors associated with development of multi-class resistance in HIV-infected breastfeeding infants. These studies will also assess whether infants in this setting are more likely to acquire multi-class resistance from transmission of resistant HIV from the mother (selected from her HAART regimen), or from exposure to ARV drugs in breast milk. This information will facilitate the design and implementation of strategies for HIV prevention and treatment in resource-constrained settings.      "
5 R01 AI087520-04,"   DESCRIPTION (provided by applicant): HIV continues to infect human populations worldwide, emphasizing the need for epidemiological tools that can accurately describe transmission patterns. Thus, the methods we will develop will have specific impact on HIV vaccines; evolution; epidemiological parameters: spread of infection in different groups; intervention; and more generally on the fundamental science of infectious diseases. The overall goal is to understand the relationship between virus evolution and its epidemiological history, and to create epidemiological tools that can make reliable contact tracings and assess changes in epidemic dynamics. We have recently shown that the epidemic rate is inversely correlated to the virus evolutionary rate on the population level. Thus, the specific hypothesis behind the proposed research is that there is a relationship between the speed at which an epidemic moves through a human population and the rate at which the virus evolves in that population. We have observed that there are discrepancies between transmission histories and viral phylogenies, and because the inferences of epidemics are based on phylogenetics, it becomes important to understand the limitations in such inferences. Based on this the specific aims of this proposal are to: 1. Create a model that accurately describes the connection between transmission history and viral phylogeny. Preliminary results suggest that there are ""hidden lineages"" in viral phylogenies that are involved in transmission events, potentially misleading reconstruction of transmission events. We will especially investigate the effects of the effective population size in the donor, the bottleneck at transmission, and incomplete lineage sorting during transmission and sampling. We aim to estimate meaningful confidence levels on reconstructed person-to-person transmissions enabling us to explore alternative hypotheses in a statistical framework specifically designed for epidemiological tracking. 2. Identify the mechanism that correlates epidemic rate and virus evolutionary rate. We will decipher the connection between epidemic rate and viral evolutionary rate. Currently, we have four alternative explanations that may cause the observed correlation between epidemic and evolutionary rate (host immune selection, viral generation time effects, selection during transmission, and recombination effects). We will use different gene sequence data, codon positions as well as amino acid signatures to discriminate between these hypothetical explanations. We will use large datasets to develop epidemiological models that include these four hypothetical explanations to investigate their effects on the population level, and also model social networks and epidemic and phylogeographic dynamics.      "
5 R01 AI094607-03,"   DESCRIPTION (provided by applicant): HIV prevalence in sub-Saharan Africa is highest of any global region and many infections occur among youth ages 15-24 years. Comprehensive HIV prevention in high-burden sub-Saharan African settings must address both HIV and pregnancy among young females, and HIV prevention strategies among males, using evidence-based approaches in combination. Settings such as Nyanza Province, western Kenya where there is high HIV prevalence, high fertility rates, early onset of sex, frequent intergenerational sex and low circumcision prevalence are a high priority for developing and evaluating multi-component HIV prevention with a focus on young men and women in order to have a large population impact. Our team of biobehavioral and clinical scientists, mathematical modelers, and trial design specialists will: Identify gender (sex)-specific drivers of HIV acquisition risk, including pregnancy among females, for youth in sub-Saharan Africa, and interventions to best address those risks (Aim 1). Conduct mathematical modeling to select optimal combination intervention package components and to assess potential population-level impact (Aim 2). In partnership with a highly-productive nongovernmental organization (NGO) that is delivering PEPFAR-funded HIV prevention services, develop and pilot a combination HIV prevention package specific for female and for male youth - 'MP3-Youth' - in Migori district, Nyanza Province (Aim 3). We will deliver the MP3-Youth package using community-based mobile health teams with the NGO. All youth attending the mobile health events will complete an audio computer-assisted self-interview survey. A randomly-selected subset of n=200 youth will be followed longitudinally at 6- and 12- months using cell phone text message surveys to prospectively assess prevention method uptake, adherence, and risk compensation behaviors. Design a phase IV study protocol for testing the effectiveness of a gender-specific youth HIV prevention package in sub-Saharan Africa (Aim 4). We will disseminate these research protocol recommendations, and study instruments including the mathematical modeling tool, as a combination prevention intervention research toolkit. The MP3-Youth study will provide critical information for design and evaluation of combination HIV prevention intervention packages that are sensitive to gender-specific risks among this most-at-risk population in high-HIV burden African settings.      "
5 R01 AI097265-02,"    DESCRIPTION (provided by applicant): Mucosal transmission of HIV involves a strong bottleneck effect and most often, a single founder virus is transmitted. The relative contributions of stochastic (random) selection vs. active selection by specific viral and host characteristics to this bottleneck are unclear. Mother-to-child HIV-1 transmission (MTCT) through breastfeeding, in which transmission pairs and timing of infant infection are readily identified, provides an instructive model to address these important and unresolved questions. We will use serial samples from a large, well characterized cohort of HIV-1 infected Zimbabwean women who transmitted HIV-1 through breastmilk. This cohort includes women with chronic HIV-1 infection (CI; N=35), and women who acquired primary HIV-1 infection post-partum (acute infection, AI; N=13). We combine phylogenetics (with frequency analyses based on deep sequencing data) with functional assays (CD4 and co-receptor use, entry kinetics, neutralization sensitivity), to quantitatively and comprehensively analyze the relationship of founder viruses to maternal blood or breastmilk variants, quantify the relative contributions of stochastic vs. active selectio, identify selection pressures on envelope (env), differentiate when selection pressures may operate during the transmission bottleneck, and determine whether founder env variants are better adapted than other non- transmitted variants for postnatal MTCT. Delineation of the biologic properties of transmitted variants along with mapping the genetic bases of these biologic properties, should improve understanding of HIV-1 entry and the mechanisms of action of HIV-1 entry inhibitors. These studies will also improve our understanding of the in vivo selective pressures exerted by autologous neutralizing antibodies and innate factors in two distinct and relevant anatomic compartments (blood, where levels of antibodies are high, and breastmilk, where they are much lower) and the potential role of neutralization sensitivity or escape in transmission. Finally, these studies will specifically reveal whether increasing the neutralizing activity of blood or breastmilk (e.g., through passive or active immunization) or targeting other Env functional properties (tropism, infectivity) hold promise to block primary infection of women and children.        "
5 R01 AI098420-03,"One of the great enduring mysteries in disease ecology is the timing of the AIDS pandemic. AIDS emerged as a clinical entity in the late 1970s, but HIV-1, the retrovirus that causes pandemic AIDS, entered the human population from wild primates many decades earlier, probably near the turn of the 20th century. Where was HIV during this long interval? We propose a novel ecological model for the delayed emergence of AIDS. Conceptually, in a metapopulation consisting of multiple, loosely interconnected sub-populations, a pathogen could persist at low levels indefinitely through a dynamic balance between localized transmission, localized extinction, and long-distance migration between sub-populations. This situation might accurately describe a network of villages in which population sizes are small and rates of migration are low, as would have been the case in Sub-Saharan Africa over a century ago. We will test our model in a highly relevant non-human primate system. In 2009, we documented three simian retroviruses co-circulating in a metapopulation of wild red colobus monkeys (Procolobus rufomitratus) in Kibale National Park, Uganda, where we have conducted research for over two decades. We will collect detailed data on social interactions, demography, health, and infection from animals in a core social group. We will also study a series of 20 red colobus sub-populations, each inhabiting a separate, isolated forest fragment. We will determine the historic connectivity of these sub-populations using a time series of remotely sensed images of forest cover going back to 1955, as well as using population genetic analyses of hypervariable nuclear DNA markers. We will assess the infection status of each animal over time and use viral molecular data to reconstruct transmission pathways. Our transmission models will define the necessary conditions for a retrovirus to persist, but they will not be sufficient to explain why a retrovirus might emerge. This is because human social factors ultimately create the conditions that allow zoonotic diseases to be transmitted from animal reservoirs and to spread. We will therefore conduct an integrated analysis of the root eco-social drivers of human-primate contact and zoonotic transmission in this system. We will study social networks to understand how social resources structure key activities relevant to human-primate contact and zoonotic transmission risk, and we will explore knowledge, beliefs, and perceptions of human-primate contact and disease transmission for a broad sample of the population. We will reconcile perceived risk with actual risk through a linked human health survey and diagnostic testing for zoonotic primate retroviruses. The ultimate product of our research will a data-driven set of transmission models to explain the long-term persistence of retroviruses within a metapopulation of hosts, as well as a linked analysis of how human social factors contribute to zoonotic infection risk in a relevant Sub-Saharan African population. Our study will elucidate not only the origins of HIV/AIDS, but also how early-stage zoonoses in general progress from ""smoldering"" subclinical infections to full-fledged pandemics."
5 R01 CA083679-13,"DESCRIPTION (provided by applicant): Human papillomaviridae comprise a large family of DNA viruses tropic for mucosal or cutaneous epithelium. Infections by these extremely prevalent pathogens can result in epithelial hyperproliferation, including ano-genital warts and laryngeal papillomas. Infections by the high-risk (HR) mucosal genotypes such as HPV-16 and HPV-18 and closely related types can progress to high grade dysplasias and cancers, notably cervical, penile, anal, and a fraction of head and neck carcinomas. Globally, over 1000 people, primarily women, die each day of HPV diseases. Prophylactic vaccines to HPV-6, -11, -16 and -18 effectively prevent new infections by these four virus types, but there are no therapeutic agents that are consistently efficacious and specific against papillomaviruses. HPVs infect basal keratinocytes, while the productive phase occurs only in the differentiated strata of squamous epithelia. We demonstrated that E7 destabilizes p130 (a member of the pRB family of pocket proteins) in the differentiated keratinocytes, enabling the S phase reentry and progression necessary for viral DNA amplification. The HR HPV E6 is known to degrade the major tumor suppressor p53 and a number of additional host proteins. The transmembrane protein E5 up-regulates the signal transduction of the ErbB family of receptor tyrosine kinases. Thus, HR HPV E7 and E6 together can immortalize primary human keratinocytes (PHKs), and E5 increases the efficiency. But how these E5 and E6 activities are utilized to promote the viral productive program remains elusive. This is because genetic analyses of HR HPVs have been conducted for well over a decade in organotypic raft cultures of immortalized epithelial cells that support viral productive program inefficiently. The limitation is compounded by the inability of E6 mutants to persist in PHKs or to immortalize them. We recently established a simple, effective, and reproducible method to generate HPV genomic plasmids in PHKs by using Cre-loxP mediated excisional recombination in vivo. A robust productive program was recapitulated by the wild type HPV-18 genome in PHK raft cultures, and progeny virions were passaged for the first time in raft cultures of naive PHKs. We validated the utility of our system for HPV genetic analyses by successfully examining an E6 mutant genome, not previously possible. Our results showed that a full-length E6 protein is necessary for efficient viral DNA amplification. Importantly, this approach circumvents the need for the immortalization functions of the HR HPVs or for pre-immortalized epithelial cell lines in order to perform genetic analyses of HPVs in PHK raft cultures. Preliminary studies revealed that E5 is also critical. We have formulated specific hypotheses on the possible roles of E5 and E6 proteins and propose to exploit this PHK raft culture system to test our hypotheses and elucidate their functions in the viral productive program. Complementary genetic and biochemical approaches will be used throughout. With a thorough understanding of the pathways which HPVs dysregulate and to which HPVs are addicted, targets of therapeutic agents will be identified to serve as the foundation for antiviral drug discovery."
5 R01 DA003574-30,"   DESCRIPTION (provided by applicant): The Risk Factors project has studied the very large HIV epidemic among injecting drug users (IDUs) in New York City from 1978 (using stored sera) and the very large HIV epidemic among non-injecting heroin and cocaine drug users (NIDUs) since 1995. In our current research, we have demonstrated a dramatic reduction in HIV transmission among IDUs, but also a substantial increase in HIV among NIDUS. (HIV prevalence has doubled among NIDUs in NYC over the last decade). Herpes simplex virus-2 (HSV-2) is strongly associated with HIV transmission, and we have identified prevalence HSV-2 as a major factor associated with HIV transmission among NIDUs in NYC. The specific aims of the proposed research include: 1) Monitoring risk behavior, HIV prevalence and incidence and service utilization in the continuing evolution of the HIV epidemic among NIDUs and IDUs in New York City. 2) Quantifying the long-term population-level relationships between HIV and HSV-2 infections among heroin and cocaine users in NYC, including testing the hypothesis that the strength of the association between HSV-2 and HIV increases over time. Recent intervention studies have dramatically increased the need for understanding HSV-2/HIV relationships. 3) Evaluating effects of the New York City Department of Health (NYC DOH) Condom Social Marketing campaign on sexual risk behaviors and HIV and HSV-2 infection among IDUs and NIDUs in NYC. 4) Monitoring patterns of sexual and injection related HIV transmission among IDUs in NYC. There are many linkages between NIDUs and IDUs in NYC. NIDUs and IDUs are best viewed as linked groups within a single population of heroin and cocaine users in NYC. A thorough understanding of sexual transmission among NIDUs requires an understanding of both injecting and sexual transmission among IDUs in the city. 5) Assess new patterns of racial/ethnic differences in HIV infection among NIDUs and IDUs. 6) Intervention development. These aims will be accomplished through continuation of our studies of NIDUs and IDUs entering Beth Israel drug treatment programs in NYC. The proposed research will be the first study of the spread of HIV over time in a very large population of NIDUs, the first assessment of change in the relationship of HVS-2 to HIV over time among NIDUs, and the first assessment of the effects of a very large condom social marketing campaign on sexual risk behavior of NIDUs and IDUs. "
5 R01 DA010767-15,"   DESCRIPTION (provided by applicant): The overall purpose of this competing continuation is to expand our understanding of the processes associated with the development of substance use and high-risk sexual behavior from early childhood through emerging adulthood, and the processes leading to addiction and dependence in emerging adulthood. The original study began with the assessment of 1075 youth, their parents and teachers, when youth were in first through fifth grade, enabling a multi-source assessment of etiological factors measured at a young age. Annual assessments across ten years, with minimal attrition, have provided extensive data on over 950 youth, following them until they are in the 10th grade through one year post high-school. Together with the original study, the proposed data collection will extend the follow-up to one-year post high school for all youth, and add an in-depth assessment of all participants when they reach age 20/21 consisting of a diagnostic interview and a social stress test to assess cortisol reactivity. A developmental/contextual framework examining the interaction of etiological factors across four systems, biological, cognitive, personality and social, guides our research questions addressing five aims: (1) Examine the processes explaining continuity and discontinuity of the development of substance use from early childhood through adolescence and into emerging adulthood; (2) Further the understanding of the relation between the development of substance use and at-risk sexual behavior, identifying unique and common predictors; (3) Further the understanding of the relation between childhood stress and stress in emerging adulthood, and substance use and abuse/dependence and high risk sexual behavior; (4) Further the understanding of the relation of substance use to the assumption of ""adult"" roles in emerging adulthood; and (5) Assess the generalizeability of models developed with data from our primarily Caucasian sample by examining the fit of models using data from a sample consisting primarily of African Americans, the Family and Community Health Study (FACHS). Unique novel features of this study include the length of follow-up (first grade to age 21), annual assessments during childhood and adolescence enabling the identification of classes of trajectories, and the integration of psychological with biological variables. The assessment in emerging adulthood of cortisol reactivity, a biological marker of stress associated with substance use and addiction, further expands the etiological framework underpinning this project. The generality and importance of findings from this project will be extended significantly through collaboration with the FACHS by enabling a comparison of etiological processes between African American and primarily Caucasian youth. These findings will guide future prevention and intervention efforts for youth by identifying etiological processes occurring from the early elementary years through emerging adulthood that place individuals at risk or that are protective, including the relation between stress reactivity and addiction. "
5 R01 DA012237-13,"Substance misuse is the leading preventable cause of morbidity and mortality in females. Effective  prevention of substance misuse by females, depends, in part on increased understanding of femalespecific  risk and protective factors that influence pathways toward and away from addiction. The main  goal of the proposed research, which directly addresses NIDA strategic priorities in prevention, is to  investigate factors influencing the development of substance use, abuse, and dependence in girls  during a period of peak risk (ages 15-22). This renewal requests continuation of NIDA support for 5  further annual substance use assessments (i.e., Years 11-15) with girls and their parent as a  substudy to the NIMH-funded Pittsburgh Girls Study (PGS; N = 2,451; 52% African American, 41%  Caucasian), a longitudinal, population-based study of the development of conduct problems and  depression in four cohorts of girls, initially assessed at ages 5 to 8. The next 5 years, which will cover  ages 15-22 in an accelerated longitudinal design, are critical to understanding factors influencing the  development of substance use and HIV risk behaviors (e.g., risky sexual behavior) during  adolescence and the transition to young adulthood. The proposed project aims to: (1) characterize  trajectories of substance use, abuse, and dependence in girls, starting in childhood, through  adolescence, and into emerging adulthood; (2) examine trajectories of girls substance involvement in  conjunction with the developmental course of psychopathology (e.g., depression) and other problem  behaviors (e.g., risky sexual behavior); (3) determine how proximal and distal risk and protective  factors (both general and female-specific) influence the development of substance involvement in  girls, including analyses of differences by ethnicity; and (4) to simultaneously examine trajectories of  substance use and HIV risk behaviors to determine how these health compromising behaviors  interact over time to influence HIV risk in females. The proposed continuation of 5 annual substance  use assessments, in conjunction with 10 waves of data already collected, will permit the linkage of  childhood factors to substance use and HIV risk behaviors during adolescence and emerging  adulthood. The PGS, as one of very few population-based studies of females in the US, is uniquely  suited to addressing gaps in knowledge regarding the ways in which individual, environmental, and  developmental factors interact to influence substance use in a large, urban sample of African  American and Caucasian girls. Study findings will be used to improve substance use and HIV risk  screening, and to guide prevention efforts for females."
