PROJECT_NUMBER,ABSTRACT_TEXT1
2 U01 AI031834-21,"     DESCRIPTION (provided by applicant): As the HIV epidemic moves into its third decade it is increasingly a disease of older women who have age-related co-morbidities, and concomitant prolonged exposure to the virus, to ART, and to the metabolic consequences of both infection and therapy. The WIHS in general, and the Brooklyn site in particular, are ideally suited to address the most salient questions related to an aging female cohort. We propose three projects that capture important aspects of the HIV epidemic in aging women. Each project contains specific studies with their own sets of aims and hypotheses. Project 1 focuses on neurocognition, metabolic, and vascular factors in HIV and includes three studies: 1. Adipose tissue, genetic susceptibility, and neurocognition; 2. The HIV-Neuroimaging Initiative; 3. Vascular factors and neurocognition. Project 2 focuses on aging biomarkers in HIV and includes two studies: 1. Frailty-Physical, functional and neurocognitive aspects of aging; 2. Reproductive aging and telomeres. Project 3 focuses on behaviors and implementation science approaches to understanding and promoting successful aging in HIV. It includes three studies: 1. Life course transitions and care engagement; 2. An intervention to increase adherence among women who have experienced childhood sexual abuse; 3. An intervention to enhance smoking cessation. The Brooklyn site, the largest WIHS site, has an exceptional record in cohort retention as well as participation in WIHS leadership and substudies. We further energize our activities for WIHS-V by expanding our cadre of co-investigators and biostatisticians to include those with expertise matched to the aforementioned projects and studies. Dr. Minkoff, who has been chair of the WIHS EC for over a decade, will be joined in a dual-PI leadership role by Dr. Deborah Gustafson, a neuroepidemiologist who has worked with aging cohorts in Sweden and Argentina. Among the many new collaborators are Dr. David Keefe, Chair of OB/GYN at NYU and one of the nation's leaders in reproductive aging, and Dr. Richard Havlik who has served at the NIH in research related to aging. We will also collaborate with the Alzheimer's Disease Neuroimaging Initiative, led by Dr. Michael Weiner. These and other new investigators will join an array of established site investigators, including Dr. Tracey Wilson who heads the WIHS behavioral working group, Dr. Howard Crystal, a neurologist who has a WIHS-linked R01 and many others, to assure the scientific productivity of the site. We have also established a biostatistical core, with members whose expertise corresponds to our project needs, including Drs. Lanza and Yang (Penn State) and Dr. Wilson (SUNY) for analysis of the behavioral projects; Drs. Gustafson (SUNY), Nalls (Molecular Genetics Section, NIA, NIH), Donahue (UCSD) and Weedon (SUNY) for neurocognitive, neuroimaging, and genetic analyses; and Dr. Wu (Penn State) for telomere analysis. Given our exemplary track record to date, in conjunction with an innovative fusion of new and seasoned investigators, and an invigorated statistical core, we look forward to a continued productive relationship with our colleagues in WIHS.          "
2 U01 AI034989-20,"     DESCRIPTION (provided by applicant): The WIHS is the largest and longest-duration cohort study of HIV infection in women in the U.S. The San Francisco Bay Area WIHS (SF WIHS) application is focused on continuing our contributions to WIHS: 1. Enrollment and retention of participants (including HIV+ women who are not in care) via a regional consortium and generation of complete and high quality data and specimens, 2. The vigorous participation of site investigators in the WIHS scientific process, and 3. Proposal of new aims that address key issues concerning processes and conditions associated with excess morbidity in HIV+ women in the current treatment era. The new aims feature special emphasis on vascular injury and pain and were selected because they concern key morbidities in potent antiretroviral therapy (cART) treated women, involve sex dimorphic  phenomena, and may be influenced by gonadal aging. Vascular measures include indicators of medium (Ankle Brachial Index) and very small vessel condition (measures of retinal vessel caliber). We put forward an increased focus on functional outcomes, including specific organ functional measures, and total physical  fitness and morphology (such as kyphosis). The pain studies take the unique approach of assessing what  participants mean when they report pain, assess genetic contributions and examine outcomes that include  physical function. We also propose to continue our work to measure long term exposure to antiretroviral  drugs (ARVs) using hair samples, which are producing high impact reports concerning the pharmacology of  ARVs in women and continuation of the WIHS Genetics Unit that was recently established in SF WIHS and is  conducting Genome-Wide Association Studies.          "
2 U01 AI034993-20,"     DESCRIPTION (provided by applicant): With the HIV Prevention Treatment Network 052 study proving that early antiretroviral (ART) initiation reduces rates of HIV sexual transmission and clinical events, and with women making up 50% of people living with HIV globally, a better understanding of how women with HIV start, stay on and respond to ART and how this therapy impacts prevention, treatment, and care/cure of HIV/AIDS is needed. African American women continue to bear the largest burden of HIV disease among women, with disproportionately higher rates of new HIV infections, AIDS diagnoses, and mortality. The major goal of this proposal is to continue the high level of productivity of the Chicago WIHS Consortium (CWC) as both a clinical research site and as a consortium of scientific leaders with a track record of advancing our understanding of the evolving HIV epidemic in US women. We will continue to rapidly recruit and retain a representative cohort of women with and at risk for HIV, to collect th highest quality data in order to lead and pursue innovative epidemiologic analyses, and multidisciplinary investigations to characterize treated HIV disease in women. Over the WIHS-V five year period, we will continue to design, implement, synthesize, and disseminate findings from investigations which explore the dynamic and complex relationships between HIV, ART, viral suppression, sociodemographics, behaviors, mental illness, immune biomarkers, menopausal stage, and comorbidities rather than focusing on the impact of any one single factor. The CWC investigative team proposes to expand and retain the Chicago cohort and to apply analytic modeling to longitudinal social/behavioral, clinical, neurocognitive, and pathogenesis data to develop and test a gender specific prognostic index (""WIHS Index""). We aim to identify psychological, neuroendocrine, genetic, and immunologic predictors of HIV disease phenotypes, including those characterized by inflammation, activation, and cellular senescence and determine the association with clinical and pre-clinical measures of HIV associated non AIDS (HANA) co-morbidities. Since evidence suggests that potentially modifiable factors, such as untreated mental illness, chronic life stress, and use of addictive substances can contribute to inflammation and accelerate telomere shortening, a key molecular marker of cellular senescence, we will explore the interactions between psychiatric diagnoses, hormonal patterns, and markers of the innate and adaptive immune system. Given the high rates of these modifiable factors in our cohort, we propose a multi-site randomized controlled trial to test an evidence based computerized tailored intervention based on the Transtheoretical Model to address risk behaviors concurrently aimed at smoking cessation, improving ART adherence, and effectively managing stress, depression, and weight. Through these WIHS V efforts, we hope to identify new tools that can be used at all levels of HIV care (community, clinic, and laboratory) to empower clinicians and their female patients to improve the prognosis and lives of women with HIV.          "
2 U01 AI034994-20,"     DESCRIPTION (provided by applicant): Since 1993, the Washington Metropolitan WIHS (WMW) Consortium has enrolled and retained a representative community cohort of HIV-infected and uninfected women with the purpose of supporting NIAID in understanding the current epidemiology of HIV, risk behaviors, disease progression, treatment uptake and outcomes, and related co-morbidities. The early cohort of infected women is aging, and the effects of age and menopausal status on disease outcomes and co-morbidities is yet to be elucidated. The WMW has joined with centers around the country and with sites across metropolitan Washington, DC to address these issues. This is particularly pertinent as Washington, DC has the highest prevalence of HIV of any urban center in the U.S. and the WMW has enrolled and retained a cohort that represents women both ethnically and psychosocially. The WMW has successfully participated in all elements of the WIHS protocol and has actively supported the infrastructure of the national WIHS. WMW investigators have participated in all of the major WIHS scientific initiatives. Additionally, with its rich data baseand local and national specimen repository, the WMW has supported local and national initiatives designed to understand the pathophysiology underlying co-morbidities. The WMW proposes to continue this work and to expand its research portfolio by continuing its strong collaborative relationship with the national WIHS in the area of protocol development, implementation, sub study participation, and identification of new initiatives. Additionally, for the next cycle of funing we have proposed new initiatives that include a telephone-based intervention for depression that will positively impact adherence and health behaviors with the goal of reducing community viral load. This intervention can easily be implemented in the larger DC community. We are expanding our local initiatives on HIV and HCV associated liver disease by engaging a team of researchers in exploring the host response, epigenetic factors, and protein glycosylation in liver disease and cancer. We will also continue and expand our investigations in organ specific morbidities associated with long-term survival in an aging population with the goal of reducing or preventing morbidity in the areas of vascular health, neurocognitive decline, and the vaginal immunologic response in aging. We will accomplish this by engaging with national and local investigators with proven expertise in these areas to further leverage the NIH investment in this important cohort of women. This will allow us to better define the status of women with HIV and bring to fruition the goals of an AIDS free generation and effective and sustainable treatment for those already infected.          "
2 U01 AI035004-20,"     DESCRIPTION (provided by applicant): 2011 was a transformative year in HIV research, providing evidence and raising hope that the HIV epidemic globally can potentially be not only controlled but also effectively aborted in our lifetime through both prevention and cure. Effective  primary prevention through microbicides, pre-exposure prophylaxis and treatment of persons living with HIV (PLWH) seems within our reach. Equally important, basic science advances suggest that cure is possible through activation and/or elimination of HIV proviral DNA from host cells. We propose a WIHS scientific agenda that informs these possible routes to defeating HIV, through investigations of genital tract innate immune factors protecting against HIV-infection; identification of epigenetic changes in the provirus that may define a target for cure; and elucidating cell-to-cell viral transfer. We will continue to use WIHS's robust database to inform effective treatment for women and persons of African descent. Of the 34.0 million PLWH globally more than half of are women, and more than 75% are of African ancestry; nearly all studies of the efficacy of antiretroviral therapy (ART) are in men of European descent. Thus, epidemiologic and translational investigation of population- based effectiveness of ART in WIHS, which is 100% women and >60% of African descent, will provide critical information for patients and providers both in the US and globally. Further, with 18 years of prospective data collection the WIHS is able to investigate clinical manifestations in aging populations, including studies of changes in the genital tract with reproductive aging. The Bronx WIHS has provided both operational excellence and scientific leadership nationally since WIHS's inception in 1993. In WIHS V we will continue to lead the WIHS-wide investigations in HPV and cervical neoplasia; cardiovascular disease and inflammation; genital tract mucosal immunology and virology; immunogenetics; HIV virology; musculoskeletal manifestations of HIV disease; and host characteristics influencing population based effectiveness of ART. We will also continue our excellent operational performance in providing high volume, complete, high quality data both for the WIHS core activities, and all substudies.          "
2 U01 AI042590-16,"     DESCRIPTION (provided by applicant): The Women's Interagency HIV Study (WIHS) is a large, comprehensive prospective cohort study designed to investigate a spectrum of questions relating to the pathogenesis and natural history of HIV infection among women in the era of highly active antiretroviral therapy. The purpose of this application is to extend support of the WIHS Data Management and Analysis Center (WDMAC) that will continue to provide leadership in contributing epidemiological and statistical expertise to the WIHS research agenda, provide a stable and efficient data management system, and provide coordination of study protocols and WIHS investigator initiatives to enhance the quality and validity of the data and the scientific research in the WIHS. The specific aims of WDMAC are: (1) To provide scientific leadership in a Clinical Research Agenda focusing on analytical methods, strategies for improving antiretroviral therapy adherence using both modeling and an innovative randomized behavioral intervention trial, and in-depth cohort profiles of the clinical epidemiology of HIV; (2) To optimize the contributions of the WIHS to the understanding of the pathogenesis and natural and treated history of HIV infection in women through collaboration and scientific partnerships; (3) To coordinate research initiatives and scientific presentations by facilitating communication among WIHS and external investigators, Working Groups and committees; to orchestrate study protocol and form revision; and produce study-wide profiles of cohort characteristics (WIHS Dossier), and scientific publications (WIHS Archives); (4) To maintain and refine our web-based data management system and assess feasibility and coordinate the transition from paper-based data collection. We will continue our systems for: tracking the storage and transfer of biological specimens at national repositories, producing annual public data sets, and conducting training in methods that facilitates the appropriate use of study data for local research; (5) To continue our quality assurance program in partnership with the clinical sites that integrates expertise in data management, study coordination, statistical methodology, and scientific disciplines. This program will continue to monitor study-wide quality and promote adherence and training for standardized data collection.          "
268201100002I-0-26800003-1,"The objectives of the REDS-III program are to ensure safe and effective blood banking and transfusion medicine practices through a comprehensive, multi-targeted strategy involving basic, translational, and clinical research to improve the benefits of transfusion while reducing its risks. Improving blood component safety and availability in the U.S. and internationally through the conduct of epidemiologic, survey, and laboratory studies is the cornerstone of the REDS program. Transfusion therapy is the most commonly employed, and, arguably, one of the least understood medical procedures in the U.S. affecting about five million recipients annually. This research program is not only critical to public health in the U.S. but also to countries struggling with the HIV epidemic where blood safety and availability are major concerns. The REDS-III program is comprised of one Data Coordinating Center (DCC), one Central Laboratory, four domestic hubs, and three international collaborative programs involving U.S. investigators and investigators at international blood centers. The REDS-III program will target the following blood banking and transfusion medicine areas: donor targeted strategies; blood banking; transfusion practices in adult patients; and education and training."
268201100007I-0-26800002-1,"The objectives of the REDS-III program are to ensure safe and effective blood banking and transfusion medicine practices through a comprehensive, multi-targeted strategy involving basic, translational, and clinical research to improve the benefits of transfusion while reducing its risks. Improving blood component safety and availability in the U.S. and internationally through the conduct of epidemiologic, survey, and laboratory studies is the cornerstone of the REDS program. Transfusion therapy is the most commonly employed, and, arguably, one of the least understood medical procedures in the U.S. affecting about five million recipients annually. This research program is not only critical to public health in the U.S. but also to countries struggling with the HIV epidemic where blood safety and availability are major concerns. The REDS-III program is comprised of one Data Coordinating Center (DCC), one Central Laboratory, four domestic hubs, and three international collaborative programs involving U.S. investigators and investigators at international blood centers. The REDS-III program will target the following blood banking and transfusion medicine areas: donor targeted strategies; blood banking; transfusion practices in adult patients; and education and training. The goal of the International program is to address scientific questions to improve the safety and adequacy of the blood supply in selected low or middle income countries affected by the HIV/AIDS epidemic. The REDS-III international sites shall conduct epidemiologic, laboratory, and survey research primarily on blood donors with a major research focus on reducing and preventing the transmission of HIV/AIDS and other known and emerging infectious agents through transfusion. Studies in transfusion recipients may also be conducted.  The major objectives of the research in the international program are: 1) assess and monitor the prevalence and incidence of HIV-1, HIV-2 and other existing as well as newly discovered infectious agents that pose a threat to blood safety; 2) assess risks of transfusion-transmitted infections; 3) assess the impact of existing and new blood donor screening methodologies on blood safety and availability; 4) evaluate characteristics and behaviors of blood donors including risk factors for acquiring HIV and other blood-borne agents; and 5) evaluate the donation process for ways to improve the safety and adequacy of the blood supply. Some studies may also address transfusion recipient safety concerns such as evaluating non-infectious transfusion risks (e.g., alloimmunization) and ways to reduce their occurrence."
268201100008I-0-26800002-1,"The objectives of the REDS-III program are to ensure safe and effective blood banking and transfusion medicine practices through a comprehensive, multi-targeted strategy involving basic, translational, and clinical research to improve the benefits of transfusion while reducing its risks. Improving blood component safety and availability in the U.S. and internationally through the conduct of epidemiologic, survey, and laboratory studies is the cornerstone of the REDS program. Transfusion therapy is the most commonly employed, and, arguably, one of the least understood medical procedures in the U.S. affecting about five million recipients annually. This research program is not only critical to public health in the U.S. but also to countries struggling with the HIV epidemic where blood safety and availability are major concerns. The REDS-III program is comprised of one Data Coordinating Center (DCC), one Central Laboratory, four domestic hubs, and three international collaborative programs involving U.S. investigators and investigators at international blood centers. The REDS-III program will target the following blood banking and transfusion medicine areas: donor targeted strategies; blood banking; transfusion practices in adult patients; and education and training. The goal of the International program is to address scientific questions to improve the safety and adequacy of the blood supply in selected low or middle income countries affected by the HIV/AIDS epidemic. The REDS-III international sites shall conduct epidemiologic, laboratory, and survey research primarily on blood donors with a major research focus on reducing and preventing the transmission of HIV/AIDS and other known and emerging infectious agents through transfusion. Studies in transfusion recipients may also be conducted.  The major objectives of the research in the international program are: 1) assess and monitor the prevalence and incidence of HIV-1, HIV-2 and other existing as well as newly discovered infectious agents that pose a threat to blood safety; 2) assess risks of transfusion-transmitted infections; 3) assess the impact of existing and new blood donor screening methodologies on blood safety and availability; 4) evaluate characteristics and behaviors of blood donors including risk factors for acquiring HIV and other blood-borne agents; and 5) evaluate the donation process for ways to improve the safety and adequacy of the blood supply. Some studies may also address transfusion recipient safety concerns such as evaluating non-infectious transfusion risks (e.g., alloimmunization) and ways to reduce their occurrence."
268201100009I-0-26800002-1,"The objectives of the REDS-III program are to ensure safe and effective blood banking and transfusion medicine practices through a comprehensive, multi-targeted strategy involving basic, translational, and clinical research to improve the benefits of transfusion while reducing its risks. Improving blood component safety and availability in the U.S. and internationally through the conduct of epidemiologic, survey, and laboratory studies is the cornerstone of the REDS program. Transfusion therapy is the most commonly employed, and, arguably, one of the least understood medical procedures in the U.S. affecting about five million recipients annually. This research program is not only critical to public health in the U.S. but also to countries struggling with the HIV epidemic where blood safety and availability are major concerns. The REDS-III program is comprised of one Data Coordinating Center (DCC), one Central Laboratory, four domestic hubs, and three international collaborative programs involving U.S. investigators and investigators at international blood centers. The REDS-III program will target the following blood banking and transfusion medicine areas: donor targeted strategies; blood banking; transfusion practices in adult patients; and education and training. The goal of the International program is to address scientific questions to improve the safety and adequacy of the blood supply in selected low or middle income countries affected by the HIV/AIDS epidemic. The REDS-III international sites shall conduct epidemiologic, laboratory, and survey research primarily on blood donors with a major research focus on reducing and preventing the transmission of HIV/AIDS and other known and emerging infectious agents through transfusion. Studies in transfusion recipients may also be conducted.  The major objectives of the research in the international program are: 1) assess and monitor the prevalence and incidence of HIV-1, HIV-2 and other existing as well as newly discovered infectious agents that pose a threat to blood safety; 2) assess risks of transfusion-transmitted infections; 3) assess the impact of existing and new blood donor screening methodologies on blood safety and availability; 4) evaluate characteristics and behaviors of blood donors including risk factors for acquiring HIV and other blood-borne agents; and 5) evaluate the donation process for ways to improve the safety and adequacy of the blood supply. Some studies may also address transfusion recipient safety concerns such as evaluating non-infectious transfusion risks (e.g., alloimmunization) and ways to reduce their occurrence."
272200800014C-15-0-1,"The purpose of this contract is to provide scientific, technical and operational expertise for NIAID HIV and AIDS research and particularly clinical research activities that are conducted as part of grant and contract awards."
