PROJECT_NUMBER,ABSTRACT_TEXT1
5 K01 AA020228-04,"DESCRIPTION (provided by applicant): This proposed K-01 career development award explores patterns of concurrent sexual partnerships, or partnerships that overlap in time, among urban African Americans in Philadelphia. I am an Assistant Professor of Medicine (Research) in the Division of Infectious Diseases at Brown University Medical School. I hope to use the K-01 award to transition from health policy to behavioral and social science research in HIV/AIDS prevention. My long-term career goals are to pursue an academic career in order to conduct behavioral and sociological research in the field of HIV/AIDS, to publish articles in the peer- reviewed literature, and conduct HIV/AIDS research that influences public policy. I hope to use the K01 award to learn how to conduct community-based participatory research (CPBR), develop new quantitative skills for behavioral science research, acquire expertise in behavioral research for HIV prevention and HIV intervention research, and gain expertise in health disparities research and ethical conduct of research in underserved populations. The research components of my application follow: Community-based participatory research (CBPR) approaches will be employed to explore 32-40 African American community leaders' opinions and knowledge about sexual concurrency and other factors contributing to HIV health disparities among urban African Americans. CBPR will also be used to examine African American community leaders' interest in developing and piloting novel interventions to address concurrent sexual relationships and other factors contributing to HIV health disparities among African Americans. Subsequently, differential rates of sexual concurrency and other factors that may contribute to racial disparities in HIV rates among African Americans testing for HIV in Philadelphia will be explored. This analysis will rely on secondary survey data collected during Philadelphia's rapid testing campaign, which tests approximately 6,000 people annually. The beliefs, attitudes, practices, patterns and causes of concurrent sexual partnerships will then be explored through 80 in-depth qualitative interviews among HIV- negative African American men and women testing for HIV in Philadelphia. In keeping with the CBPR framework guiding this study, the findings of each of the aforementioned research projects will be shared and explored with African American community leaders and the Philadelphia community at large. Community input about the study findings, appropriate interpretations, interventions, and public policy suggestions will be solicited. The findings from the aforementioned studies will then be used to design an R01 grant application proposing an HIV prevention intervention. The intervention will combine behavioral and social interventions to address concurrent sexual partnerships, and may aim to increase condom use rates with main and non-main partners, reduce concurrent sexual partners, or address other factors contributing to HIV health disparities among HIV-negative African Americans."
5 K01 AI091440-04,"   DESCRIPTION (provided by applicant): This proposal describes a four year career development and training plan for Erik Volz, an Assistant Research Scientist in the Department of Epidemiology at the University of Michigan-Ann Arbor. Training will aid with the development of a career in Epidemiology with a focus on infectious diseases, especially HIV and other sexually transmitted infections.       The training program will allow Dr. Volz to acquire skills in areas necessary for expertise in the field of HIV epidemiology while conducting substantial research in areas where he already has established a strong publishing record. Dr. Volz will be mentored by a team of three faculty with experience ranging from complex systems modeling of infectious diseases to the microbiology and pathology of HIV infection and the evolution of viruses. The School of Public Health at the University of Michigan is an excellent venue for junior faculty seeking to develop a career as an independent investigator. A large community of research faculty and postdoctoral fellows are available as potential collaborators and as an audience for work in progress.       Research supported by this award will concern the use of novel sources of HIV genetic data for fitting models of the HIV epidemic. The union of mathematical epidemiology, immunology and phylogenetics has been dubbed ""phylodynamics"", and Dr. Volz has made recent progress on the theory necessary to unify traditional models of infectious disease epidemics with the evolution of HIV described by phylogenetic trees. The potential of phylodynamic methods was demonstrated recently as the first estimates of the fundamental reproduction number, R0, for pandemic H1N1 came from the analysis of several dozen influenza genetic sequences, not from traditional epidemiological surveillance data. Dr. Volz hopes to refine these methods and develop them into a practical tool for epidemiologists engaging in HIV surveillance. A collaboration will be established with the Michigan Department of Community Health to analyze a database of several thousand HIV sequences collected from newly diagnosed individuals since 2004. By applying phylodynamic models to this large set of sequences, Dr. Volz will attempt to answer longstanding questions about the transmission patterns of HIV. This research will generate novel estimates of R0, the temporal distribution of transmissions post-infection, the fraction of transmissions that happen during acute and early HIV infection, demographic determinants of infection and transmission risk, and behavioral heterogeneity and sexual network structure.       "
5 K01 AI095060-02,"    DESCRIPTION (provided by applicant): Sub-Saharan Africa accounts for approximately 10% of the world's population, but is home to approximately 70% of the 2.7 million people estimated to be newly infected with HIV worldwide annually, and 35% of the estimated 8.8 million new tuberculosis (TB) cases. The burden of HIV and TB in Africa is reflected in higher rates of both infections in African emigrants to other countries when compared to their local counterparts. The goal of this career development award is to gain expertise in TB epidemiology and control, and research methodologies that will broaden my abilities to address HIV, TB, and other health issues in the African population in the US. My longer-term career objective is to improve the overall health of this population through both research and public health practice. The proposed research addresses questions crucial to the development of effective HIV and TB prevention and control programs for the African-born population. The specific aims of the proposal are to: 1) Estimate the extent to which transmission of HIV and TB occurs prior to arrival in the US among African-born persons, identify barriers to HIV testing and missed opportunities for HIV diagnoses among African-born US residents, and define the potential risk of ongoing HIV and TB transmission both within and outside of the African-born community; 2) Evaluate missed opportunities for TB screening and diagnosis, describe delays in diagnosis of active TB in the African population compared to non-Africans, and estimate the prevalence of TB genotypes typically seen in African- born patients in non-African populations; and 3) Develop projections for the size and composition of the African-born HIV and TB epidemics in the US over the next 20 years, using a combination of demographic and dynamic epidemic modeling. The career development component of the application is designed to augment my existing skills in the areas of HIV and STD epidemiologic research. The proposed educational aims will allow me to build skills in four specific areas necessary to carry out my research aims, and include training in: 1) TB epidemiology and control, 2) Demography and mathematical modeling, 3) Immigration and health. The unparalleled training environment at the University of Washington (UW), the close and collaborative relationships between the UW and the HIV/STD and TB Programs of Public Health - Seattle and King County, and the exceptional team of mentors and advisors that will supervise my training and research will further contribute to my career development and transition into a successful independent investigator.         "
5 K01 AI098527-02,"    DESCRIPTION (provided by applicant): This proposal outlines a five-year career development and research plan to train the candidate as an independent epidemiologic investigator focused on outcomes research in international settings. The candidate's strong academic performance and international work on HIV-1 risk factors and transmission, including generalizability of prevention interventions, demonstrates his expertise in epidemiologic methodology and applied research. As a doctoral candidate, he led the epidemiologic design and analysis of a large prospective cohort study of discordant couples in Kenya. This research experience was enhanced by a postdoctoral fellowship in which he investigated barriers to timely initiation of antiretroviral therapy (ART) and developed mathematical models for the impact of the distribution of risk factors on generalizability of intervention trials. This K01 award will enablethe candidate to integrate this background into a new line of investigation on the implementation of behavioral interventions to promote HIV/AIDS care and treatment. The candidate will be supported by expert mentors to provide guidance and ensure the success of this project. An enriching institutional environment will support his career development. RESEARCH PLAN. Half of patients testing positive for HIV-1 at voluntary counseling and testing (VCT) centers in Sub-Saharan Africa fail to link with HIV/AIDS care. This highlights a critical deficiency in the health system that can be addressed with interventions to improve linkage to care that will slow disease progression, accelerate ART initiation, and improve health outcomes. We hypothesize that an implementation science approach will produce a package of interventions to improve linkage to care and treatment that will be rapidly scalable across sites in Africa. We will test a behavioral intervention and evaluate new point-of-care (POC) CD4 testing to improve linkage to care. The specific aims are to (1) determine if a VCT-based intervention of CD4 count testing, alone or in combination with peer counseling, improves linkage to HIV/AIDS care; (2) assess the impact of the intervention on ART initiation; and (3) determine if rapid return of CD4 results using new POC testing improves linkage to care compared to conventional testing with delayed return of results. First, we will conduct a rapid assessment of barriers to care among patients, counselors, and health providers to refine the intervention (VCT-based CD4 counts and peer counseling). We will then recruit 450 HIV-positive individuals from VCTs and randomize a third to standard counseling and referral, a third to receive CD4 testing at the VCT with results return by phone after two weeks, and a third to receive the same CD4 testing combined with peer counseling. We will recruit an additional 150 participants to receive POC CD4 testing with rapid return of results and compare their linkage to care rates to those receiving CD4 results after two weeks. These combined investigations will create a comprehensive understanding of obstacles to appropriate HIV/AIDS care and result in new interventions to achieve measurable outcomes in applied settings. Through this award the candidate will gain new expertise in implementation science and will become an independent investigator focused on health interventions in resource-limited settings.        "
5 K01 DA025504-05,"   DESCRIPTION (provided by applicant):  This 5 year career development award will provide the candidate with training in mixed research methods and their applications to understanding substance use and migration impacts on HIV and blood borne infections (BBIs) in minority and vulnerable populations. The new qualitative and mixed-methods training coupled with a Ph.D. in public health and prior health services research will prepare the candidate for independent, policy oriented research on complex social and migration factors in HIV prevention in minority and disadvantaged communities. The proposed career and training goals employ didactic and mentored learning to: (1) Develop a thorough understanding of social and environmental factors that contribute to substance use and facilitate transmission of BBIs in migrants; (2) Acquire expertise in developing and implementing mixed-methods protocols (i.e., qualitative and quantitative methods) to study substance use issues; (3) Obtain ongoing training in the ethical conduct in research, especially vis--vis vulnerable populations; (4) Develop the skills necessary for a successful academic research career (e.g., publishing peer reviewed papers, presenting at professional meetings, grantsmanship); and (5) Acquire an in-depth understanding of theory-based interventions that may reduce transmission of BBIs among migrant injection drug users (IDUs). A key aspect of this training involves investigating the influence of migration on risky substance use and sexual behaviors among migrant female sex workers who inject drugs (FSW-IDUs) in Tijuana, a city on the U.S.-Mexico border. The prevalence of HIV in FSW-IDUs is 12.3% This study uses a mixed-methods approach to (1) characterize prior and future migration decisions and resources of FSW- IDUs in Tijuana; (2) Describe the influence of community and family migration experiences on FSW-IDUs' decisions to engage in sex work and substance use behaviors, and (3) Examine the relationship between migration factors and engagement in risky sex and substance use behaviors. Data generated from this study will be used by the applicant to develop an R01 or R34 targeting migrant FSW-IDUs and HIV risks in the U.S.-Mexico border region. RELEVANCE (See instnjections): The "
5 K01 DA029571-04,"   DESCRIPTION (provided by applicant):  This K01 proposal entitled ""Moving Toward Independence: Exploring neurological and endocrine determinants of adolescent and young adult risky behavior decision-making"" in response to the program announcement (PA-09-040) proposes a rigorous mixed methods approach to examine how adolescents and young adults (ages 18-24) make decisions about engaging in risky behaviors. This one-year longitudinal study, the first of its kind, incorporates fMRI, salivary samples, genital swabs, and ACASI (Audio Computer Assisted Self-Interview) and in-the-moment text messaging survey methods into one project to examine neurological, hormonal, psychological, and contextual determinants of sexual risk practices and substance use and their related outcomes (e.g., HIV, STIs, substance use disorders, drug dependency, depression). The objective and specific aims of this study are listed below: Objective: The research questions motivating the proposed study are: Why do young adults engage in risky behaviors (sexual and substance use) when they are knowledgeable about consequences? To what extent do these youth experience feelings of depressive symptoms, heightened stress, and physical consequences (e.g., STIs, HIV, drug use disorders)? How do relationships between determinants of risk and outcomes change over time? Aim 1: Assess, using fMRI whether cognitive control brain regions of interest (CCROIs: prefrontal cortex pruning and parietal association cortex; dorsolateral prefrontal cortex; ventromedial prefrontal cortex; anterior and posterior cingulate, and temporo-parietal cortices) and socio-emotional brain regions of interest (SEROIs: medial frontal cortex, left ventral striatum - in the accumbens, left superior temporal sulcus, left medial tempor- al, amygdala) are differentially active in youths who take fewer sexual and substance use risks relative to youths taking greater risks. Aim 2: Assess, via four salivary measures per day, whether testosterone (T) and dehydroepiandrosterone (DHEA) levels and diurnal patterns vary as a function of the cognitive control and socio-emotional network brain region activity and development for young women and men. Aim 3: Investigate how activation in cognitive control relative to socio-economic brain networks relates to youths' reports of (a) mental health outcomes and (b) physical health outcomes. By extension, assess how hormone and brain region patterns (e.g., high T with low cognitive control) relate to youths' reports of sexual risk, substance use, drug abuse and dependency, and mental health. Aim 4: Assess changes in brain function as well as hormone diurnal changes over one year's development and whether these changes are related to (1) each other and (2) changes/ stability in sexual risk behavior and substance use outcomes as well as mental health outcomes. At the completion of this project, as a young investigator I will (1) learn the fundamentals of neuroscience and endocrinology, sufficient to launch my independent career, and (2) have a better understanding of how hormones, brain region activity, and context influence a young person's risky behaviors and how these hormones and brain ROI relate to risky behaviors and mental health outcomes over time. This work will advance the current knowledge of adolescent and young adult decision-making and mental health and behavioral outcomes by creating and assessing a more comprehensive model via integrating psychological, biological, and contextual perspectives, and will serve as the basis for an R01 application and future analyses beyond the scope of this study.      "
5 K01 DA031031-04,"   DESCRIPTION (provided by applicant):  The purpose of this Mentored Research Scientist Development Award (K01) is threefold. This award will allow me to: 1) learn a new skill set (social network analysis; SNA), 2) broaden my understanding of the social epidemiology of HIV among drug users in a new cultural and environmental context (the US/Mexico border), and 3) facilitate my transition to becoming a productive NIH-funded independent investigator at the University of California San Diego. The training aims will be accomplished through a combination of specific workshops and coursework, a hands-on practicum, and one-on-one mentoring with a Training Committee comprised of experts in the areas of HIV prevention research among vulnerable populations, behavioral intervention design, social network analysis, and HIV social epidemiology research in international contexts (and specifically the US/Mexico border region). The research aims will be accomplished by conducting a cross-sectional study of the social network factors associated with HIV risk behavior among 200 drug-using male clients of female sex workers (FSWs) in Tijuana, Mexico. The US/Mexico border is experiencing a burgeoning HIV epidemic, concentrated among high-risk groups such as drug users and FSWs. Social network analysis (SNA) has been used for many years in the US to understand the role of drug user social networks in regional HIV transmission, but rarely has it been used between regions or across international borders, which are characterized by high levels of cross-border mobility. Understanding the role of social networks in highly mobile ""bridging"" populations is critical to a more nuanced and contextualized understanding of infectious disease transmission in border regions. The proposed research will allow me to apply newly acquired skills in SNA to evaluate the structure, composition, and influence of social networks, and the degree of interaction among drug, sex, and social networks of a particularly high-risk group: US and Tijuana-based drug-using male clients of FSWs. This population exhibits high rates of drug use (25% report ever injecting drugs, and up to 88% report lifetime use of cocaine, heroin, or methamphetamine) and considerable sexual risk behavior with both FSWs and other partners (including 66% who report concurrent sex and drug use). Findings from the proposed research will be critical for developing tailored interventions for individuals at risk for HIV via sex and drug use in border regions, and for the development of future research into the mobility-HIV risk pathway. Further, developing skills in social network analysis will uniquely position me as one of only a handful of mixed-methods researchers in the field of drug abuse possessing such skills, and the only one in the Division of Global Public Health at the University of California San Diego.      PUBLIC HEALTH RELEVANCE:  The US/Mexico border is home to an evolving HIV epidemic among vulnerable groups such as drug users, including female sex workers (FSWs) and their clients, but little social epidemiological research has assessed the role of social networks in influencing transmission of HIV in this region. Findings from the proposed research will be critical to bi-national efforts to develop tailored interventions for drug users at risk for HIV, and for the development of future long-term research into the influence of social networks on HIV risk among mobile ""bridging"" populations who have the potential to connect higher- and lower-risk groups. Further, developing skills in social network analysis will uniquely position the candidate as one of only a handful of mixed-methods researchers in the field of drug abuse possessing such skills, and the only one in the Division of Global Public Health at the University of California San Diego.         "
5 K01 DA031035-03,"   DESCRIPTION (provided by applicant):  This K01 award will provide Dr. Hong Van Tieu with the necessary training and mentorship to become an independent investigator in HIV epidemiology and prevention. Her short-term goals are to expand her experience in HIV epidemiology and prevention research among men who have sex with men (MSM), gain advanced skills in epidemiology, biostatistics, social network analysis, and qualitative research, and further the understanding of the influence of sexual networks on HIV and sexual risk behaviors among Black and White MSM. She will receive specialized training in the epidemiology of substance use and its relationship to HIV risk among MSM. Her multidisciplinary mentoring team has expertise in HIV and substance use epidemiology, prevention, and clinical research and strong track records of supporting junior faculty to become independently funded investigators. The New York Blood Center has a long history of conducting HIV epidemiology and behavioral and biomedical prevention research among MSM and is profoundly committed to the success of this K01 award. The dramatically disproportionate HIV infection rates among Black MSM in the U.S remain unexplained by differences in individual behavioral risk. One hypothesis is that the characteristics of sexual networks of Black MSM place them at increased risk of HIV compared to non-Black MSM. The purpose of this study is to directly compare the structural and compositional characteristics of sexual networks between Black and White MSM and to examine the relationship of their network characteristics to HIV infection and sexual risk behaviors using an innovative combination of qualitative and quantitative research methodologies. The proposed research will enroll a large sample of Black and White MSM (n=878) in New York City as a substudy of an NIH R01-funded study to evaluate the hypothesis that certain structural (e.g., network size, density, partner concurrency) and compositional (e.g., assortative and disassortative mixing, durability of relationships) characteristics of Black MSM sexual networks increase the men's risk of HIV infection. The specific aims of this study are the following: (1) to describe and compare the structural and compositional characteristics of sexual networks between Black and White MSM at the egocentric network level, (2) to compare the association of structural and compositional characteristics of sexual networks with HIV infection and sexual risk behaviors between Black and White MSM at the egocentric network level, and determine whether differences in sexual network characteristics explain the disparity in HIV prevalence between Black and White MSM, and (3) to explore in depth the contexts and meanings of sexual partnerships and networks by evaluating how Black and White MSM subjectively experience their sexual networks and perceive them to influence their sexual risk behaviors using qualitative research methods. A focus of the research is on drug and alcohol use within sexual networks and their relationship to HIV risk among MSM. This research will provide critically important information on the sexual networks of Black MSM to explain the alarming rates of HIV infection among this population and to inform development and testing of sexual network-based intervention strategies to reduce HIV acquisition and transmission risk. It will also serve as an excellent platform for the candidate to gain essential training in HIV epidemiology and prevention research and generate innovative ideas for her first R01 grant application.      "
